id|title|body|department|sentiment|preprocessed_body
788|Parcheggio disponibile e...|Parcheggio disponibile e gratuito in hotel. Prenotazione tramite il sito istituzionale dell’hotel semplice e sicura.|Reception|pos|parcheggio disponibile e gratuito in hotel prenotazione tramite il sito istituzionale dell hotel semplice e sicura
789|Ho trascorso tre...|Ho trascorso tre giorni di relax, coccolata da personale davvero professionale e sempre disponibile.|Reception|pos|ho trascorso tre giorni di relax coccolata da personale davvero professionale e sempre disponibile
790|Ho trascorso tre...|Ho trascorso tre giorni di relax, servita da personale davvero professionale e sempre disponibile.|Reception|pos|ho trascorso tre giorni di relax servita da personale davvero professionale e sempre disponibile
791|ho apprezzato molto...|ho apprezzato molto la disponibilità del personale, sempre pronto nel venire incontro alle esigenza degli ospiti|Reception|pos|ho apprezzato molto la disponibilità del personale sempre pronto nel venire incontro alle esigenza degli ospiti
792|Ottimo servizio con...|Ottimo servizio con aperitivo di benvenuto; receptionist sempre gentili e disponibili.|Reception|pos|ottimo servizio con aperitivo di benvenuto receptionist sempre gentili e disponibili
793|Aperitivo di benvenuto...|Aperitivo di benvenuto e kit di cortesia in tutte le camere. Ottimo albergo per essere coccolati.|Reception|pos|aperitivo di benvenuto e kit di cortesia in tutte le camere ottimo albergo per essere coccolati
794|L'hotel offre anche...|L'hotel offre anche delle navette gratuite per raggiungere le località vicine. Promosso.|Reception|pos|l hotel offre anche delle navette gratuite per raggiungere le località vicine promosso
795|L'hotel offre anche...|L'hotel offre anche delle navette gratuite per raggiungere le zone vicine. Promosso.|Reception|pos|l hotel offre anche delle navette gratuite per raggiungere le zone vicine promosso
796|Magnifico staff che...|Magnifico staff che ti accoglie per tutto ciò di cui hai bisogno. Ottimo il personale del ristorante e della reception.|Reception|pos|magnifico staff che ti accoglie per tutto ciò di cui hai bisogno ottimo il personale del ristorante e della reception
797|Staff efficientissimo, molto...|Staff efficientissimo, molto presente e preparato anche sui consigli per i posti da visitare|Reception|pos|staff efficientissimo molto presente e preparato anche sui consigli per i posti da visitare
798|Staff efficientissimo, molto...|Staff efficientissimo, molto presente e preparato anche sui consigli per i posti da vedere.|Reception|pos|staff efficientissimo molto presente e preparato anche sui consigli per i posti da vedere
799|Il servizio di...|Il servizio di ricevimento ospiti è pilastro portante della struttura. Professionalità e disponibilità massime.|Reception|pos|il servizio di ricevimento ospiti é pilastro portante della struttura professionalità e disponibilità massime
800|Complimenti soprattutto al...|Complimenti soprattutto al personale di sala e reception, gentili e sempre con un occhio di riguardo verso gli ospiti.|Reception|pos|complimenti soprattutto al personale di sala e reception gentili e sempre con un occhio di riguardo verso gli ospiti
801|Servizi impeccabili e...|Servizi impeccabili e personale preparato, gentile e disponibile.|Reception|pos|servizi impeccabili e personale preparato gentile e disponibile
802|In albergo è...|In albergo è presente anche un centro benessere totalmente gratuito e molto confortevole.|Reception|pos|in albergo é presente anche un centro benessere totalmente gratuito e molto confortevole
803|In albergo è...|In albergo è presente anche un centro benessere completamente gratuito e molto confortevole.|Reception|pos|in albergo é presente anche un centro benessere completamente gratuito e molto confortevole
804|In albergo è...|In albergo è presente anche un centro salute totalmente gratuito e molto confortevole.|Reception|pos|in albergo é presente anche un centro salute totalmente gratuito e molto confortevole
805|In albergo è...|In albergo è presente anche un centro salute completamente gratuito e molto confortevole.|Reception|pos|in albergo é presente anche un centro salute completamente gratuito e molto confortevole
806|SPA interna molto...|SPA interna molto pulita e molto ben gestita dallo staff.|Reception|pos|spa interna molto pulita e molto ben gestita dallo staff
807|Apprezzo molto l'eccellente...|Apprezzo molto l'eccellente servizio clienti e l'attenzione ai dettagli|Reception|pos|apprezzo molto l eccellente servizio clienti e l attenzione ai dettagli
808|Apprezzo molto l'eccellente...|Apprezzo molto l'eccellente servizio clienti e l'attenzione ai particolari.|Reception|pos|apprezzo molto l eccellente servizio clienti e l attenzione ai particolari
809|Apprezzo molto ottimo...|Apprezzo molto ottimo servizio clienti e l'attenzione ai dettagli|Reception|pos|apprezzo molto ottimo servizio clienti e l attenzione ai dettagli
810|Apprezzo molto ottimo...|Apprezzo molto ottimo servizio clienti e l'attenzione ai particolari.|Reception|pos|apprezzo molto ottimo servizio clienti e l attenzione ai particolari
811|Ammiro molto l'eccellente...|Ammiro molto l'eccellente servizio clienti e l'attenzione ai dettagli|Reception|pos|ammiro molto l eccellente servizio clienti e l attenzione ai dettagli
812|Ammiro molto l'eccellente...|Ammiro molto l'eccellente servizio clienti e l'attenzione ai particolari.|Reception|pos|ammiro molto l eccellente servizio clienti e l attenzione ai particolari
813|Ammiro molto ottimo...|Ammiro molto ottimo servizio clienti e l'attenzione ai dettagli|Reception|pos|ammiro molto ottimo servizio clienti e l attenzione ai dettagli
814|Ammiro molto ottimo...|Ammiro molto ottimo servizio clienti e l'attenzione ai particolari.|Reception|pos|ammiro molto ottimo servizio clienti e l attenzione ai particolari
815|Ottimi servizi in...|Ottimi servizi in camera offerti dalla reception: kit di benvenuto e una bottiglia omaggio.|Reception|pos|ottimi servizi in camera offerti dalla reception kit di benvenuto e una bottiglia omaggio
816|L'albergo ha svolto...|L'albergo ha svolto un servizio di check-in in camera molto comodo e professionale.|Reception|pos|l albergo ha svolto un servizio di check in in camera molto comodo e professionale
817|Kit di cortesia...|Kit di cortesia disponibile in tutte le camere e per ogni ospite.|Reception|pos|kit di cortesia disponibile in tutte le camere e per ogni ospite
818|Check-in lento e...|Check-in lento e disorganizzato.|Reception|neg|check in lento e disorganizzato
819|Personale della reception...|Personale della reception scortese disponibile.|Reception|neg|personale della reception scortese disponibile
820|Personale della reception...|Personale della reception poco disponibile.|Reception|neg|personale della reception poco disponibile
821|dipendenti della reception...|dipendenti della reception scortese disponibile.|Reception|neg|dipendenti della reception scortese disponibile
822|dipendenti della reception...|dipendenti della reception poco disponibile.|Reception|neg|dipendenti della reception poco disponibile
823|Attesa lunga alla...|Attesa lunga alla registrazione e poca chiarezza nelle informazioni.|Reception|neg|attesa lunga alla registrazione e poca chiarezza nelle informazioni
824|Attesa lunga alla...|Attesa lunga alla registrazione e poca trasparenza nelle informazioni.|Reception|neg|attesa lunga alla registrazione e poca trasparenza nelle informazioni
825|Attesa snervante alla...|Attesa snervante alla registrazione e poca chiarezza nelle informazioni.|Reception|neg|attesa snervante alla registrazione e poca chiarezza nelle informazioni
826|Attesa snervante alla...|Attesa snervante alla registrazione e poca trasparenza nelle informazioni.|Reception|neg|attesa snervante alla registrazione e poca trasparenza nelle informazioni
827|A causa di...|A causa di un guasto è mancata l'acqua calda in camera per tutto il soggiorno|Reception|neg|a causa di un guasto é mancata l acqua calda in camera per tutto il soggiorno
828|A causa di...|A causa di un guasto è mancata l'acqua calda in camera per tutto il periodo.|Reception|neg|a causa di un guasto é mancata l acqua calda in camera per tutto il periodo
829|Ascensore non funzionante...|Ascensore non funzionante per una settimana.|Reception|neg|ascensore non funzionante per una settimana
830|Nessuno alla reception...|Nessuno alla reception e nessuno al bar che era chiuso e inaccessibile.|Reception|neg|nessuno alla reception e nessuno al bar che era chiuso e inaccessibile
831|Il mio numero...|Il mio numero di telefono trascritto sbagliato e le mie email finite nello spam! Pessimo servizio.|Reception|neg|il mio numero di telefono trascritto sbagliato e le mie email finite nello spam pessimo servizio
832|Personale scortese che...|Personale scortese che mette ansia. Qualsiasi richiesta extra viene respinta a priori.|Reception|neg|personale scortese che mette ansia qualsiasi richiesta extra viene respinta a priori
833|Personale scortese che...|Personale scortese che mette ansia. ogni richiesta extra viene respinta a priori.|Reception|neg|personale scortese che mette ansia ogni richiesta extra viene respinta a priori
834|Molto delusa! Non...|Molto delusa! Non hanno accettato un cambio di prenotazione né fornito alcun rimborso|Reception|neg|molto delusa non hanno accettato un cambio di prenotazione né fornito alcun rimborso
835|Molto delusa! Non...|Molto delusa! Non hanno accettato un cambio di prenotazione né fornito alcun indennizzo.|Reception|neg|molto delusa non hanno accettato un cambio di prenotazione né fornito alcun indennizzo
836|Non hanno nemmeno...|Non hanno nemmeno la decenza di trattare bene i pochi clienti che hanno sono senza parole.|Reception|neg|non hanno nemmeno la decenza di trattare bene i pochi clienti che hanno sono senza parole
837|Non hanno nemmeno...|Non hanno nemmeno la decenza di trattare bene i pochi ospiti che hanno sono senza parole.|Reception|neg|non hanno nemmeno la decenza di trattare bene i pochi ospiti che hanno sono senza parole
838|Non hanno nemmeno...|Non hanno nemmeno la dignità di trattare bene i pochi clienti che hanno sono senza parole.|Reception|neg|non hanno nemmeno la dignità di trattare bene i pochi clienti che hanno sono senza parole
839|Non hanno nemmeno...|Non hanno nemmeno la dignità di trattare bene i pochi ospiti che hanno sono senza parole.|Reception|neg|non hanno nemmeno la dignità di trattare bene i pochi ospiti che hanno sono senza parole
840|Addetti notturni alla...|Addetti notturni alla reception davvero incapaci e svogliati.|Reception|neg|addetti notturni alla reception davvero incapaci e svogliati
841|Addetti notturni alla...|Addetti notturni alla reception davvero incompetenti e svogliati.|Reception|neg|addetti notturni alla reception davvero incompetenti e svogliati
842|Responsabili notturni alla...|Responsabili notturni alla reception davvero incapaci e svogliati.|Reception|neg|responsabili notturni alla reception davvero incapaci e svogliati
843|Responsabili notturni alla...|Responsabili notturni alla reception davvero incompetenti e svogliati.|Reception|neg|responsabili notturni alla reception davvero incompetenti e svogliati
844|Non particolarmente accogliente...|Non particolarmente accogliente Personale svogliato se non addirittura maleducato|Reception|neg|non particolarmente accogliente personale svogliato se non addirittura maleducato
845|Non particolarmente accogliente...|Non particolarmente accogliente Personale svogliato se non addirittura sgarbato.|Reception|neg|non particolarmente accogliente personale svogliato se non addirittura sgarbato
846|Non particolarmente ospitale....|Non particolarmente ospitale. Personale svogliato se non addirittura maleducato|Reception|neg|non particolarmente ospitale personale svogliato se non addirittura maleducato
847|Non particolarmente ospitale....|Non particolarmente ospitale. Personale svogliato se non addirittura sgarbato.|Reception|neg|non particolarmente ospitale personale svogliato se non addirittura sgarbato
848|Ho dovuto chiedere...|Ho dovuto chiedere più volte per poter avere una coperta in più e per sapere come attivare il wifi.|Reception|neg|ho dovuto chiedere più volte per poter avere una coperta in più e per sapere come attivare il wifi
849|Ho dovuto chiamare...|Ho dovuto chiamare più volte per poter avere una coperta in più e per sapere come attivare il wifi.|Reception|neg|ho dovuto chiamare più volte per poter avere una coperta in più e per sapere come attivare il wifi
850|Alla reception non...|Alla reception non ti danno alcuna informazione e in camera non funziona quasi nulla|Reception|neg|alla reception non ti danno alcuna informazione e in camera non funziona quasi nulla
851|Alla reception non...|Alla reception non ti danno alcuna informazione e in camera non funziona quasi niente.|Reception|neg|alla reception non ti danno alcuna informazione e in camera non funziona quasi niente
852|Alla reception non...|Alla reception non ti danno alcuna indicazione e in camera non funziona quasi nulla|Reception|neg|alla reception non ti danno alcuna indicazione e in camera non funziona quasi nulla
853|Alla reception non...|Alla reception non ti danno alcuna indicazione e in camera non funziona quasi niente.|Reception|neg|alla reception non ti danno alcuna indicazione e in camera non funziona quasi niente
854|Il proprietario continuava...|Il proprietario continuava a tormentarci, bussava alla porta della nostra camera al mattino e cercava di entrare.|Reception|neg|il proprietario continuava a tormentarci bussava alla porta della nostra camera al mattino e cercava di entrare
855|Avevo prenotato con...|Avevo prenotato con ingresso alle 13:00, ma quando siamo arrivati non c'era nessuno ad aspettarci|Reception|neg|avevo prenotato con ingresso alle 13 00 ma quando siamo arrivati non c era nessuno ad aspettarci
856|Avevo prenotato con...|Avevo prenotato con ingresso alle 13:00, ma quando siamo arrivati non c'era nessuno ad attenderci.|Reception|neg|avevo prenotato con ingresso alle 13 00 ma quando siamo arrivati non c era nessuno ad attenderci
857|Accetta prenotazioni anche...|Accetta prenotazioni anche se non ha posti letto, dirottando su un altro albergo pessimo|Reception|neg|accetta prenotazioni anche se non ha posti letto dirottando su un altro albergo pessimo
858|Accetta prenotazioni anche...|Accetta prenotazioni anche se non ha posti letto, dirottando su un altro albergo orribile.|Reception|neg|accetta prenotazioni anche se non ha posti letto dirottando su un altro albergo orribile
859|Prende prenotazioni anche...|Prende prenotazioni anche se non ha posti letto, dirottando su un altro albergo pessimo|Reception|neg|prende prenotazioni anche se non ha posti letto dirottando su un altro albergo pessimo
860|Prende prenotazioni anche...|Prende prenotazioni anche se non ha posti letto, dirottando su un altro albergo orribile.|Reception|neg|prende prenotazioni anche se non ha posti letto dirottando su un altro albergo orribile
861|Le camere risultano...|Le camere risultano libere anche quando in realtà sono occupate|Reception|neg|le camere risultano libere anche quando in realtà sono occupate
862|Le camere risultano...|Le camere risultano libere anche quando in realtà sono impegnate.|Reception|neg|le camere risultano libere anche quando in realtà sono impegnate
863|Se vi lamentate...|Se vi lamentate della sistemazione iniziano ad urlare e a chiamarvi ladri. Da evitare come la peste.|Reception|neg|se vi lamentate della sistemazione iniziano ad urlare e a chiamarvi ladri da evitare come la peste
864|Nessuno tra il...|Nessuno tra il personale alla reception parlava la nostra lingua.|Reception|neg|nessuno tra il personale alla reception parlava la nostra lingua
865|Non c'è una...|Non c'è una reception o qualcosa di simile e quindi non si ha la possibilità di contattare nessuno.|Reception|neg|non c é una reception o qualcosa di simile e quindi non si ha la possibilità di contattare nessuno
866|Scarsa trasparenza e...|Scarsa trasparenza e poca chiarezza su politiche di cancellazione, rimborsi e depositi.|Reception|neg|scarsa trasparenza e poca chiarezza su politiche di cancellazione rimborsi e depositi
867|Problemi con la...|Problemi con la gestione di documenti o identificazioni (richiesta di documenti non chiara e eccessiva).|Reception|neg|problemi con la gestione di documenti o identificazioni richiesta di documenti non chiara e eccessiva
868|Bisognerebbe ristrutturare la...|Bisognerebbe ristrutturare la hall e assumere uno staff più cordiale|Reception|neg|bisognerebbe ristrutturare la hall e assumere uno staff più cordiale
869|Bisognerebbe ristrutturare la...|Bisognerebbe ristrutturare la hall e assumere uno staff più gentile.|Reception|neg|bisognerebbe ristrutturare la hall e assumere uno staff più gentile
870|Nessuna accoglienza, nessuno...|Nessuna accoglienza, nessuno che ti accompagni in un labirinto di scale pianerottoli fino alla tua camera.|Reception|neg|nessuna accoglienza nessuno che ti accompagni in un labirinto di scale pianerottoli fino alla tua camera
871|In ascensore entrano...|In ascensore entrano a malapena 2 persone senza valige|Reception|neg|in ascensore entrano a malapena 2 persone senza valige
872|In ascensore entrano...|In ascensore entrano a malapena 2 persone senza bagagli.|Reception|neg|in ascensore entrano a malapena 2 persone senza bagagli
873|In ascensore entrano...|In ascensore entrano a stento 2 persone senza valige|Reception|neg|in ascensore entrano a stento 2 persone senza valige
874|In ascensore entrano...|In ascensore entrano a stento 2 persone senza bagagli.|Reception|neg|in ascensore entrano a stento 2 persone senza bagagli
875|Personale poco gentile...|Personale poco gentile e frettoloso in ogni occasione|Reception|neg|personale poco gentile e frettoloso in ogni occasione
876|Personale poco gentile...|Personale poco gentile e frettoloso in ogni situazione|Reception|neg|personale poco gentile e frettoloso in ogni situazione
877|Personale poco gentile...|Personale poco gentile e frettoloso in ogni circostanza.|Reception|neg|personale poco gentile e frettoloso in ogni circostanza
878|Personale poco gentile...|Personale poco gentile e superficiale in ogni occasione|Reception|neg|personale poco gentile e superficiale in ogni occasione
879|Personale poco gentile...|Personale poco gentile e superficiale in ogni situazione|Reception|neg|personale poco gentile e superficiale in ogni situazione
880|Personale poco gentile...|Personale poco gentile e superficiale in ogni circostanza.|Reception|neg|personale poco gentile e superficiale in ogni circostanza
881|Il personale delle...|Il personale delle pulizie inizia a disturbare già alle 7:30 bussando per essere aperti.|Reception|neg|il personale delle pulizie inizia a disturbare già alle 7 30 bussando per essere aperti
882|Il personale delle...|Il personale delle pulizie inizia a infastidire già alle 7:30 bussando per essere aperti.|Reception|neg|il personale delle pulizie inizia a infastidire già alle 7 30 bussando per essere aperti
883|Reception aperta solo...|Reception aperta solo poche ore al giorno. Nessun personale durante la notte.|Reception|neg|reception aperta solo poche ore al giorno nessun personale durante la notte
884|Reception aperta solo...|Reception aperta solo poche ore al giorno. niente personale durante la notte.|Reception|neg|reception aperta solo poche ore al giorno niente personale durante la notte
885|Difficile trovare la...|Difficile trovare la camera con le scarse e scarne informazioni fornite.|Reception|neg|difficile trovare la camera con le scarse e scarne informazioni fornite
886|Difficile trovare la...|Difficile trovare la camera con le scarse e scarne indicazioni fornite.|Reception|neg|difficile trovare la camera con le scarse e scarne indicazioni fornite
887|complicato trovare la...|complicato trovare la camera con le scarse e scarne informazioni fornite.|Reception|neg|complicato trovare la camera con le scarse e scarne informazioni fornite
888|complicato trovare la...|complicato trovare la camera con le scarse e scarne indicazioni fornite.|Reception|neg|complicato trovare la camera con le scarse e scarne indicazioni fornite
889|arduo trovare la...|arduo trovare la camera con le scarse e scarne informazioni fornite.|Reception|neg|arduo trovare la camera con le scarse e scarne informazioni fornite
890|arduo trovare la...|arduo trovare la camera con le scarse e scarne indicazioni fornite.|Reception|neg|arduo trovare la camera con le scarse e scarne indicazioni fornite
891|Carenza cronica di...|Carenza cronica di personale. Non c'è mai nessuno a cui chiedere informazioni.|Reception|neg|carenza cronica di personale non c é mai nessuno a cui chiedere informazioni
892|Carenza cronica di...|Carenza cronica di personale. Non c'è mai qualcuno a cui chiedere informazioni.|Reception|neg|carenza cronica di personale non c é mai qualcuno a cui chiedere informazioni
893|Carenza costante di...|Carenza costante di personale. Non c'è mai nessuno a cui chiedere informazioni.|Reception|neg|carenza costante di personale non c é mai nessuno a cui chiedere informazioni
894|Carenza costante di...|Carenza costante di personale. Non c'è mai qualcuno a cui chiedere informazioni.|Reception|neg|carenza costante di personale non c é mai qualcuno a cui chiedere informazioni
895|Servizio lento, brusco...|Servizio lento, brusco e generalmente negativo. Pochi impiegati e spesso impreparati|Reception|neg|servizio lento brusco e generalmente negativo pochi impiegati e spesso impreparati
896|Servizio lento, brusco...|Servizio lento, brusco e generalmente negativo. Pochi impiegati e spesso inesperto.|Reception|neg|servizio lento brusco e generalmente negativo pochi impiegati e spesso inesperto
897|Cordialità di tutto...|Cordialità di tutto personale: zero assoluto. Non ci tornerò mai più.|Reception|neg|cordialità di tutto personale zero assoluto non ci tornerò mai più
898|Gentilezza di tutto...|Gentilezza di tutto personale: zero assoluto. Non ci tornerò mai più.|Reception|neg|gentilezza di tutto personale zero assoluto non ci tornerò mai più
899|C'era qualcuno al...|C'era qualcuno al mio piano che durante la notte ha iniziato a urlare piú volte svegliando tutti.|Reception|neg|c era qualcuno al mio piano che durante la notte ha iniziato a urlare pi volte svegliando tutti
900|C'era qualcuno al...|C'era qualcuno al mio piano che durante la notte ha iniziato a gridare piú volte svegliando tutti.|Reception|neg|c era qualcuno al mio piano che durante la notte ha iniziato a gridare pi volte svegliando tutti
901|Il check-in più...|Il check-in più disorganizzato mai visto. Hanno sbagliato 3 volte a scrivere i miei dati.|Reception|neg|il check in più disorganizzato mai visto hanno sbagliato 3 volte a scrivere i miei dati
902|Il check-in più...|Il check-in più disorganizzato mai visto. Hanno sbagliato 3 volte a compilare i miei dati.|Reception|neg|il check in più disorganizzato mai visto hanno sbagliato 3 volte a compilare i miei dati
903|Il check-in più...|Il check-in più caotico mai visto. Hanno sbagliato 3 volte a scrivere i miei dati.|Reception|neg|il check in più caotico mai visto hanno sbagliato 3 volte a scrivere i miei dati
904|Il check-in più...|Il check-in più caotico mai visto. Hanno sbagliato 3 volte a compilare i miei dati.|Reception|neg|il check in più caotico mai visto hanno sbagliato 3 volte a compilare i miei dati
905|Lo staff ha...|Lo staff ha risposto male e sempre negativamente a qualsiasi richiesta|Reception|neg|lo staff ha risposto male e sempre negativamente a qualsiasi richiesta
906|Lo staff ha...|Lo staff ha risposto male e sempre negativamente a qualsiasi domanda.|Reception|neg|lo staff ha risposto male e sempre negativamente a qualsiasi domanda
907|Personale non accogliente...|Personale non accogliente e poco disponibile.|Reception|neg|personale non accogliente e poco disponibile
908|La reception non...|La reception non è all'interno dell'hotel, quindi se vuoi chiedere informazioni devi prenderti la pioggia|Reception|neg|la reception non é all interno dell hotel quindi se vuoi chiedere informazioni devi prenderti la pioggia
909|La reception non...|La reception non è all'interno dell'hotel, quindi se vuoi avere informazioni devi prenderti la pioggia|Reception|neg|la reception non é all interno dell hotel quindi se vuoi avere informazioni devi prenderti la pioggia
910|Niente telefono in...|Niente telefono in camera; per contattare la reception devi usare il tuo telefono.|Reception|neg|niente telefono in camera per contattare la reception devi usare il tuo telefono
911|Niente telefono in...|Niente telefono in camera; per chiamare la reception devi usare il tuo telefono.|Reception|neg|niente telefono in camera per chiamare la reception devi usare il tuo telefono
912|Niente acqua calda,...|Niente acqua calda, solo tiepida, che in inverno è inaccettabile|Reception|neg|niente acqua calda solo tiepida che in inverno é inaccettabile
913|Niente acqua calda,...|Niente acqua calda, solo tiepida, che in inverno è inammissibile.|Reception|neg|niente acqua calda solo tiepida che in inverno é inammissibile
914|Il portiere di...|Il portiere di notte ci ha rivelato che il riscaldamento è guasto da 8 anni.|Reception|neg|il portiere di notte ci ha rivelato che il riscaldamento é guasto da 8 anni
915|Il portiere di...|Il portiere di notte ci ha rivelato che il riscaldamento è rotto da 8 anni.|Reception|neg|il portiere di notte ci ha rivelato che il riscaldamento é rotto da 8 anni
916|Il custode di...|Il custode di notte ci ha rivelato che il riscaldamento è guasto da 8 anni.|Reception|neg|il custode di notte ci ha rivelato che il riscaldamento é guasto da 8 anni
