id|title|body|department|sentiment|preprocessed_body
413|Tappeto con enormi...|Tappeto con enormi macchie, parete rotta e un bagno inquetante... Hotel da incubo.|Housekeeping|neg|tappeto con enormi macchie parete rotta e un bagno inquetante hotel da incubo
414|Tappeto con grandi...|Tappeto con grandi macchie, parete rotta e un bagno inquetante... Hotel da incubo.|Housekeeping|neg|tappeto con grandi macchie parete rotta e un bagno inquetante hotel da incubo
415|Lasciate fuori ogni...|Lasciate fuori ogni speranza. Albergo brutto, stanze pessime e sporche.|Housekeeping|neg|lasciate fuori ogni speranza albergo brutto stanze pessime e sporche
416|Maniglia rotta, la...|Maniglia rotta, la porta non si può chiudere se non direttamente a chiave. Arredi vecchi e trascurati.|Housekeeping|neg|maniglia rotta la porta non si può chiudere se non direttamente a chiave arredi vecchi e trascurati
417|Bagno puzzolente, non...|Bagno puzzolente, non lavato da chissà quanto. Luce dello specchio con almeno tre dita di polvere.|Housekeeping|neg|bagno puzzolente non lavato da chissà quanto luce dello specchio con almeno tre dita di polvere
418|Doccia spaventosa tendina...|Doccia spaventosa tendina rotta che non sta su. Filtro dell'aria intasato di polvere.|Housekeeping|neg|doccia spaventosa tendina rotta che non sta su filtro dell aria intasato di polvere
419|Doccia terribile, tendina...|Doccia terribile, tendina rotta che non sta su. Filtro dell'aria intasato di polvere.|Housekeeping|neg|doccia terribile tendina rotta che non sta su filtro dell aria intasato di polvere
420|Piumone e lenzuola...|Piumone e lenzuola con delle macchie. Peli di altri clienti nel letto. Crepe sui muri.|Housekeeping|neg|piumone e lenzuola con delle macchie peli di altri clienti nel letto crepe sui muri
421|Camere e tutta...|Camere e tutta la struttura da rivedere Non terribile ma molto trascurato.|Housekeeping|neg|camere e tutta la struttura da rivedere non terribile ma molto trascurato
422|Camere e tutta...|Camere e tutta la struttura da controllare. Non terribile ma molto trascurato.|Housekeeping|neg|camere e tutta la struttura da controllare non terribile ma molto trascurato
423|Albergo sporco, fatiscente,...|Albergo sporco, fatiscente, coperte macchiate di urina e chissà che cos'altro.|Housekeeping|neg|albergo sporco fatiscente coperte macchiate di urina e chissà che cos altro
424|Polvere ovunque, moquette...|Polvere ovunque, moquette sporca letto sfondato|Housekeeping|neg|polvere ovunque moquette sporca letto sfondato
425|Polvere ovunque, moquette...|Polvere ovunque, moquette sporca letto malconcio.|Housekeeping|neg|polvere ovunque moquette sporca letto malconcio
426|Polvere ovunque, moquette...|Polvere ovunque, moquette sozza, letto sfondato|Housekeeping|neg|polvere ovunque moquette sozza letto sfondato
427|Polvere ovunque, moquette...|Polvere ovunque, moquette sozza, letto malconcio.|Housekeeping|neg|polvere ovunque moquette sozza letto malconcio
428|sporcizia ovunque, moquette...|sporcizia ovunque, moquette sporca letto sfondato|Housekeeping|neg|sporcizia ovunque moquette sporca letto sfondato
429|sporcizia ovunque, moquette...|sporcizia ovunque, moquette sporca letto malconcio.|Housekeeping|neg|sporcizia ovunque moquette sporca letto malconcio
430|sporcizia ovunque, moquette...|sporcizia ovunque, moquette sozza, letto sfondato|Housekeeping|neg|sporcizia ovunque moquette sozza letto sfondato
431|sporcizia ovunque, moquette...|sporcizia ovunque, moquette sozza, letto malconcio.|Housekeeping|neg|sporcizia ovunque moquette sozza letto malconcio
432|Finestre della camera...|Finestre della camera rotte e impossibili da chiudere arredi vecchi e rotti.|Housekeeping|neg|finestre della camera rotte e impossibili da chiudere arredi vecchi e rotti
433|Finestre della camera...|Finestre della camera rotte e impossibili da sigillare, arredi vecchi e rotti.|Housekeeping|neg|finestre della camera rotte e impossibili da sigillare arredi vecchi e rotti
434|Finestre della camera...|Finestre della camera guaste e impossibili da chiudere arredi vecchi e rotti.|Housekeeping|neg|finestre della camera guaste e impossibili da chiudere arredi vecchi e rotti
435|Finestre della camera...|Finestre della camera guaste e impossibili da sigillare, arredi vecchi e rotti.|Housekeeping|neg|finestre della camera guaste e impossibili da sigillare arredi vecchi e rotti
436|TV e wifi...|TV e wifi fuori uso. Arredi vecchi, aria condizionata non funzionante.|Housekeeping|neg|tv e wifi fuori uso arredi vecchi aria condizionata non funzionante
437|Uno schifo simile...|Uno schifo simile non l'ho mai visto. Vacanza squallida per colpa dell'albergo.|Housekeeping|neg|uno schifo simile non l ho mai visto vacanza squallida per colpa dell albergo
438|Dire che fa...|Dire che fa pena è fargli un complimento! Struttura squallida e vecchissima.|Housekeeping|neg|dire che fa pena é fargli un complimento struttura squallida e vecchissima
439|Dire che fa...|Dire che fa pena è fargli un complimento! Struttura desolata e vecchissima.|Housekeeping|neg|dire che fa pena é fargli un complimento struttura desolata e vecchissima
440|La camera è...|La camera è da film horror. Fuggite finchè siete in tempo.|Housekeeping|neg|la camera é da film horror fuggite finché siete in tempo
441|Finestre che non...|Finestre che non servono a niente, ci sono spifferi e si sente ogni rumore esterno.|Housekeeping|neg|finestre che non servono a niente ci sono spifferi e si sente ogni rumore esterno
442|Finestre che non...|Finestre che non servono a niente, ci sono spifferi e si sente ogni suono esterno.|Housekeeping|neg|finestre che non servono a niente ci sono spifferi e si sente ogni suono esterno
443|Il bagno cade...|Il bagno cade a pezzi, lo sciacquone non è funzionante, la doccia quasi fredda e non regolabile.|Housekeeping|neg|il bagno cade a pezzi lo sciacquone non é funzionante la doccia quasi fredda e non regolabile
444|Il bagno cade...|Il bagno cade a pezzi, lo scarico non è funzionante, la doccia quasi fredda e non regolabile.|Housekeeping|neg|il bagno cade a pezzi lo scarico non é funzionante la doccia quasi fredda e non regolabile
445|Stanza freddissima! Termosifoni...|Stanza freddissima! Termosifoni spenti il 31 dicembre.|Housekeeping|neg|stanza freddissima termosifoni spenti il 31 dicembre
446|Stanza freddissima! Termosifoni...|Stanza freddissima! Termosifoni chiusi il 31 dicembre.|Housekeeping|neg|stanza freddissima termosifoni chiusi il 31 dicembre
447|Moquette e tappeti...|Moquette e tappeti macchiati ovunque. Muri neri di polvere. Evitate questa struttura|Housekeeping|neg|moquette e tappeti macchiati ovunque muri neri di polvere evitate questa struttura
448|Moquette e tappeti...|Moquette e tappeti macchiati ovunque. Muri neri di polvere. Evitate questa sistemazione.|Housekeeping|neg|moquette e tappeti macchiati ovunque muri neri di polvere evitate questa sistemazione
449|Un vero e...|Un vero e proprio incubo. Dovevamo restare 2 giorni diventati poi 1 per lo schifo nella stanza.|Housekeeping|neg|un vero e proprio incubo dovevamo restare 2 giorni diventati poi 1 per lo schifo nella stanza
450|Bagni pessimi, diroccati...|Bagni pessimi, diroccati distrutti e sporchi, puzza di polvere ovunque.|Housekeeping|neg|bagni pessimi diroccati distrutti e sporchi puzza di polvere ovunque
451|Moquette sporca, macchiata,...|Moquette sporca, macchiata, bucata, bruciata, e impolverata. Muri crepati e cadenti.|Housekeeping|neg|moquette sporca macchiata bucata bruciata e impolverata muri crepati e cadenti
452|Doghe rotte nel...|Doghe rotte nel letto, termosifone non funzionante, finestre con spifferi in ogni angolo.|Housekeeping|neg|doghe rotte nel letto termosifone non funzionante finestre con spifferi in ogni angolo
453|assi rotte nel...|assi rotte nel letto, termosifone non funzionante, finestre con spifferi in ogni angolo.|Housekeeping|neg|assi rotte nel letto termosifone non funzionante finestre con spifferi in ogni angolo
454|L'esperienza peggiore che...|L'esperienza peggiore che ci sia mai capitata. Non funziona niente e sporco ovunque.|Housekeeping|neg|l esperienza peggiore che ci sia mai capitata non funziona niente e sporco ovunque
455|Struttura vecchia per...|Struttura vecchia per non parlare della camera sporca.|Housekeeping|neg|struttura vecchia per non parlare della camera sporca
456|Struttura antiquata, per...|Struttura antiquata, per non parlare della camera sporca.|Housekeeping|neg|struttura antiquata per non parlare della camera sporca
457|Pulizia zero nel...|Pulizia zero nel bagno.|Housekeeping|neg|pulizia zero nel bagno
458|Pulizia inesistente nel...|Pulizia inesistente nel bagno.|Housekeeping|neg|pulizia inesistente nel bagno
459|Terribili le condizioni...|Terribili le condizioni in cui versa; moquette nera (in origine era rossa ed a fiori), camera maleodorante.|Housekeeping|neg|terribili le condizioni in cui versa moquette nera in origine era rossa ed a fiori camera maleodorante
460|Struttura vecchia e...|Struttura vecchia e camera piena di crepe che dà l'impressione possa crollare da un momento all'altro!|Housekeeping|neg|struttura vecchia e camera piena di crepe che dà l impressione possa crollare da un momento all altro
461|Coperte macchiate e...|Coperte macchiate e polvere ovunque. Camera rumorosa e poco attrattiva.|Housekeeping|neg|coperte macchiate e polvere ovunque camera rumorosa e poco attrattiva
462|Coperte sporche e...|Coperte sporche e polvere ovunque. Camera rumorosa e poco attrattiva.|Housekeeping|neg|coperte sporche e polvere ovunque camera rumorosa e poco attrattiva
463|La struttura lascia...|La struttura lascia molto a desiderare: sporca e trascurata.|Housekeeping|neg|la struttura lascia molto a desiderare sporca e trascurata
464|La camera lascia...|La camera lascia molto a desiderare: sporca e trascurata.|Housekeeping|neg|la camera lascia molto a desiderare sporca e trascurata
465|Camera brutta vecchia...|Camera brutta vecchia e sporca, ma il pezzo forte è il bagno, scomodo e indecente è dir poco!|Housekeeping|neg|camera brutta vecchia e sporca ma il pezzo forte é il bagno scomodo e indecente é dir poco
466|Esperienza davvero pessima....|Esperienza davvero pessima. Scale, corridoi, stanze, sono rivestite di moquette consumata e impolverata.|Housekeeping|neg|esperienza davvero pessima scale corridoi stanze sono rivestite di moquette consumata e impolverata
467|Il letto puzzava...|Il letto puzzava di polvere la tv non trasmetteva nessun canale|Housekeeping|neg|il letto puzzava di polvere la tv non trasmetteva nessun canale
468|Il letto puzzava...|Il letto puzzava di polvere la tv non trasmetteva nessun segnale.|Housekeeping|neg|il letto puzzava di polvere la tv non trasmetteva nessun segnale
469|Il letto puzzava...|Il letto puzzava di stantio, la tv non trasmetteva nessun canale|Housekeeping|neg|il letto puzzava di stantio la tv non trasmetteva nessun canale
470|Il letto puzzava...|Il letto puzzava di stantio, la tv non trasmetteva nessun segnale.|Housekeeping|neg|il letto puzzava di stantio la tv non trasmetteva nessun segnale
471|Bagno terribile, stretto...|Bagno terribile, stretto per nulla funzionale e con molti accessori fuori uso.|Housekeeping|neg|bagno terribile stretto per nulla funzionale e con molti accessori fuori uso
472|Bagno terribile, angusto,...|Bagno terribile, angusto, per nulla funzionale e con molti accessori fuori uso.|Housekeeping|neg|bagno terribile angusto per nulla funzionale e con molti accessori fuori uso
473|Atmosfera e ambiente...|Atmosfera e ambiente cupi e tristi. Tutto vecchio o guasto.|Housekeeping|neg|atmosfera e ambiente cupi e tristi tutto vecchio o guasto
474|Sporco e freddo,...|Sporco e freddo, non ci ritornerò.|Housekeeping|neg|sporco e freddo non ci ritornerò
475|Le camere cadono...|Le camere cadono a pezzi e la pulizia non è eccellente|Housekeeping|neg|le camere cadono a pezzi e la pulizia non é eccellente
476|Le camere cadono...|Le camere cadono a pezzi e la pulizia non è ottimale.|Housekeeping|neg|le camere cadono a pezzi e la pulizia non é ottimale
477|Niente wifi, niente...|Niente wifi, niente aria condizionata, poca pulizia e servizi inesistenti.|Housekeeping|neg|niente wifi niente aria condizionata poca pulizia e servizi inesistenti
478|Avremmo preferito non...|Avremmo preferito non trovare i boxer di qualcun altro accanto al letto. Devo continuare?|Housekeeping|neg|avremmo preferito non trovare i boxer di qualcun altro accanto al letto devo continuare
479|Edificio datato e...|Edificio datato e interni trasandati con ovunque una sudicia moquette.|Housekeeping|neg|edificio datato e interni trasandati con ovunque una sudicia moquette
480|Copriletto lercio, porte...|Copriletto lercio, porte rattoppate e malconce, doccia, priva di piatto, adiacente al wc (doppio uso?).|Housekeeping|neg|copriletto lercio porte rattoppate e malconce doccia priva di piatto adiacente al wc doppio uso
481|Non consiglio a...|Non consiglio a nessuno questo albergo. Sudiciume e strafottenza ovunque.|Housekeeping|neg|non consiglio a nessuno questo albergo sudiciume e strafottenza ovunque
482|Non consiglio a...|Non consiglio a nessuno questo albergo. Sudiciume e menefreghismo ovunque.|Housekeeping|neg|non consiglio a nessuno questo albergo sudiciume e menefreghismo ovunque
483|Stanza piccolissima e...|Stanza piccolissima e poco pulita. 0 comfort.|Housekeeping|neg|stanza piccolissima e poco pulita 0 comfort
484|Stanza piccolissima e...|Stanza piccolissima e poco pulita. nessun comfort.|Housekeeping|neg|stanza piccolissima e poco pulita nessun comfort
485|Aria condizionata a...|Aria condizionata a malapena funzionante, wifi inesistente.|Housekeeping|neg|aria condizionata a malapena funzionante wifi inesistente
486|Le pareti sono...|Le pareti sono sottilissime e si sente molto rumore dalle altre camere.|Housekeeping|neg|le pareti sono sottilissime e si sente molto rumore dalle altre camere
487|Le pareti sono...|Le pareti sono sottilissime e si sente molto caos dalle altre camere.|Housekeeping|neg|le pareti sono sottilissime e si sente molto caos dalle altre camere
488|L'hotel è vecchio...|L'hotel è vecchio e logoro e poco curato. La pittura completamente scrostata dalle pareti.|Housekeeping|neg|l hotel é vecchio e logoro e poco curato la pittura completamente scrostata dalle pareti
489|Macchie sulle lenzuola...|Macchie sulle lenzuola e aria condizionata non funzionante. Non ci ritornerei.|Housekeeping|neg|macchie sulle lenzuola e aria condizionata non funzionante non ci ritornerei
490|Bagno con doccia...|Bagno con doccia senza saliscendi e senza bidet, assenza di asciugacapelli.|Housekeeping|neg|bagno con doccia senza saliscendi e senza bidet assenza di asciugacapelli
491|Igiene scarsa, per...|Igiene scarsa, per non parlare della moquet d'annata non adeguatamente pulita.|Housekeeping|neg|igiene scarsa per non parlare della moquet d annata non adeguatamente pulita
492|Stanza logora, moquette...|Stanza logora, moquette bisunta, bagno troppo piccolo con odore tremendo|Housekeeping|neg|stanza logora moquette bisunta bagno troppo piccolo con odore tremendo
493|Stanza logora, moquette...|Stanza logora, moquette bisunta, bagno troppo piccolo con odore orrendo.|Housekeeping|neg|stanza logora moquette bisunta bagno troppo piccolo con odore orrendo
494|Camera in stato...|Camera in stato miserevole e odore pungente in ogni ambiente.|Housekeeping|neg|camera in stato miserevole e odore pungente in ogni ambiente
495|Uno dei letti...|Uno dei letti era rotto, condizionatore d'aria vecchio e rumoroso, non abbiamo avuto acqua calda.|Housekeeping|neg|uno dei letti era rotto condizionatore d aria vecchio e rumoroso non abbiamo avuto acqua calda
496|L'hotel è datato,...|L'hotel è datato, vetusto. Avrebbe bisogno di un rinnovamento totale.|Housekeeping|neg|l hotel é datato vetusto avrebbe bisogno di un rinnovamento totale
497|È un posto...|È un posto che sconsiglio vivamente! Ai limiti della decenza per camere, bagno, pulizie... Non andateci!|Housekeeping|neg|é un posto che sconsiglio vivamente ai limiti della decenza per camere bagno pulizie non andateci
498|Le camere avrebbero...|Le camere avrebbero bisogno di maggiori cure e manutenzione.|Housekeeping|neg|le camere avrebbero bisogno di maggiori cure e manutenzione
499|Albergo molto vecchio...|Albergo molto vecchio e malconcio. Camere cupe e asfissianti senza nessun comfort.|Housekeeping|neg|albergo molto vecchio e malconcio camere cupe e asfissianti senza nessun comfort
500|Camere vecchie e...|Camere vecchie e sudicie. Esperienza tristissima da non ripetere.|Housekeeping|neg|camere vecchie e sudicie esperienza tristissima da non ripetere
501|Camere vecchie e...|Camere vecchie e sudicie. Esperienza bruttissima da non ripetere.|Housekeeping|neg|camere vecchie e sudicie esperienza bruttissima da non ripetere
502|Bagno sporco al...|Bagno sporco al limite della decenza, senza acqua calda né phon.|Housekeeping|neg|bagno sporco al limite della decenza senza acqua calda né phon
503|Letto scomodo e...|Letto scomodo e cuscini così sottili da essere inutili. Pulizia approssimativa.|Housekeeping|neg|letto scomodo e cuscini così sottili da essere inutili pulizia approssimativa
504|Camere poco confortevoli,...|Camere poco confortevoli, poco curate e poco pulite.|Housekeeping|neg|camere poco confortevoli poco curate e poco pulite
505|Bagno piccolissimo disfunzionale...|Bagno piccolissimo disfunzionale e anche molto sporco.|Housekeeping|neg|bagno piccolissimo disfunzionale e anche molto sporco
506|Bagno piccolissimo disfunzionale...|Bagno piccolissimo disfunzionale e anche parecchio sporco.|Housekeeping|neg|bagno piccolissimo disfunzionale e anche parecchio sporco
507|Bagno strettissimo, disfunzionale...|Bagno strettissimo, disfunzionale e anche molto sporco.|Housekeeping|neg|bagno strettissimo disfunzionale e anche molto sporco
508|Bagno strettissimo, disfunzionale...|Bagno strettissimo, disfunzionale e anche parecchio sporco.|Housekeeping|neg|bagno strettissimo disfunzionale e anche parecchio sporco
509|Hotel da evitare;...|Hotel da evitare; condizioni della struttura pessime. Ogni cosa o è vecchia o è rotta!|Housekeeping|neg|hotel da evitare condizioni della struttura pessime ogni cosa o é vecchia o é rotta
510|Delusione e rimpianto....|Delusione e rimpianto. Albergo vecchio e sporco.|Housekeeping|neg|delusione e rimpianto albergo vecchio e sporco
511|Delusione e rimpianto....|Delusione e rimpianto. Alloggio vecchio e sporco.|Housekeeping|neg|delusione e rimpianto alloggio vecchio e sporco
512|Amarezza e rimpianto....|Amarezza e rimpianto. Albergo vecchio e sporco.|Housekeeping|neg|amarezza e rimpianto albergo vecchio e sporco
513|Amarezza e rimpianto....|Amarezza e rimpianto. Alloggio vecchio e sporco.|Housekeeping|neg|amarezza e rimpianto alloggio vecchio e sporco
514|Muffa alle pareti...|Muffa alle pareti e sporcizia, copriletti strappati e ricuciti, termosifoni inesistenti, doccia senza box.|Housekeeping|neg|muffa alle pareti e sporcizia copriletti strappati e ricuciti termosifoni inesistenti doccia senza box
515|Se volete alloggiare...|Se volete alloggiare in questo hotel, dimenticate la pulizia e la comodità.|Housekeeping|neg|se volete alloggiare in questo hotel dimenticate la pulizia e la comodità
516|Se volete alloggiare...|Se volete alloggiare in questo hotel, scordate la pulizia e la comodità.|Housekeeping|neg|se volete alloggiare in questo hotel scordate la pulizia e la comodità
517|Se volete pernottare...|Se volete pernottare in questo hotel, dimenticate la pulizia e la comodità.|Housekeeping|neg|se volete pernottare in questo hotel dimenticate la pulizia e la comodità
518|Se volete pernottare...|Se volete pernottare in questo hotel, scordate la pulizia e la comodità.|Housekeeping|neg|se volete pernottare in questo hotel scordate la pulizia e la comodità
519|Il rubinetto che...|Il rubinetto che perde e il condizionatore rumoroso non ci hanno fatto chiudere occhio.|Housekeeping|neg|il rubinetto che perde e il condizionatore rumoroso non ci hanno fatto chiudere occhio
520|Camera al 4°...|Camera al 4° piano e ascensore fuori servizio per tutta la durata del soggiorno.|Housekeeping|neg|camera al 4 piano e ascensore fuori servizio per tutta la durata del soggiorno
521|Camera al 4°...|Camera al 4° piano e ascensore fuori uso per tutta la durata del soggiorno.|Housekeeping|neg|camera al 4 piano e ascensore fuori uso per tutta la durata del soggiorno
522|Cattivi odori persistenti,...|Cattivi odori persistenti, sporco ostinato in zone difficili (fughe delle piastrelle, angoli, tendine doccia).|Housekeeping|neg|cattivi odori persistenti sporco ostinato in zone difficili fughe delle piastrelle angoli tendine doccia
523|Dotazioni mancanti o...|Dotazioni mancanti o obsolete: assenza di elementi standard.|Housekeeping|neg|dotazioni mancanti o obsolete assenza di elementi standard
524|Dotazioni mancanti o...|Dotazioni mancanti o obsolete: assenza di gadget standard.|Housekeeping|neg|dotazioni mancanti o obsolete assenza di gadget standard
525|Arredi vecchi e...|Arredi vecchi e usurati, mancanza di pulizie extra e cambi di biancheria|Housekeeping|neg|arredi vecchi e usurati mancanza di pulizie extra e cambi di biancheria
526|Arredi vecchi e...|Arredi vecchi e usurati, mancanza di pulizie extra e cambi di lenzuola.|Housekeeping|neg|arredi vecchi e usurati mancanza di pulizie extra e cambi di lenzuola
527|Stanze rumorose o...|Stanze rumorose o con problemi di isolamento acustico, scarsa illuminazione e ventilazione.|Housekeeping|neg|stanze rumorose o con problemi di isolamento acustico scarsa illuminazione e ventilazione
528|Sensazione di abbandono...|Sensazione di abbandono ovunque: muri sporchi e macchiati, pareti non imbiancate, aree comuni trascurate.|Housekeeping|neg|sensazione di abbandono ovunque muri sporchi e macchiati pareti non imbiancate aree comuni trascurate
529|Non ho potuto...|Non ho potuto fare doccia per tre giorni, era veramente disgustosa!|Housekeeping|neg|non ho potuto fare doccia per tre giorni era veramente disgustosa
530|La descrizione della...|La descrizione della struttura non corrisponde; è tutto diverso (in peggio) dalle foto.|Housekeeping|neg|la descrizione della struttura non corrisponde é tutto diverso in peggio dalle foto
531|Chiamarlo topaia é...|Chiamarlo topaia é un complimento! Camera minuscola e sporca (piena di capelli e peli ovunque).|Housekeeping|neg|chiamarlo topaia é un complimento camera minuscola e sporca piena di capelli e peli ovunque
532|Ambiente sporco, mobilia...|Ambiente sporco, mobilia vecchia. Camere molto molto piccole.|Housekeeping|neg|ambiente sporco mobilia vecchia camere molto molto piccole
533|La camera dispone...|La camera dispone di un wc rotto e la doccia e aria condizionata non funzionano.|Housekeeping|neg|la camera dispone di un wc rotto e la doccia e aria condizionata non funzionano
534|La camera dispone...|La camera dispone di un water rotto e la doccia e aria condizionata non funzionano.|Housekeeping|neg|la camera dispone di un water rotto e la doccia e aria condizionata non funzionano
535|La camera dispone...|La camera dispone di un gabinetto rotto e la doccia e aria condizionata non funzionano.|Housekeeping|neg|la camera dispone di un gabinetto rotto e la doccia e aria condizionata non funzionano
536|Abbiamo trovato un...|Abbiamo trovato un cerotto usato nel letto. Raccapricciante!|Housekeeping|neg|abbiamo trovato un cerotto usato nel letto raccapricciante
537|Check-in rapido e...|Check-in rapido e personale molto accogliente|Reception|pos|check in rapido e personale molto accogliente
538|Check-in rapido e...|Check-in rapido e personale molto cordiale.|Reception|pos|check in rapido e personale molto cordiale
539|Check-in veloce e...|Check-in veloce e personale molto accogliente|Reception|pos|check in veloce e personale molto accogliente
540|Check-in veloce e...|Check-in veloce e personale molto cordiale.|Reception|pos|check in veloce e personale molto cordiale
541|Reception efficiente e...|Reception efficiente e disponibile; risolvono qualsiasi problema in pochissimo tempo.|Reception|pos|reception efficiente e disponibile risolvono qualsiasi problema in pochissimo tempo
542|Reception efficiente e...|Reception efficiente e disponibile; risolvono qualsiasi situazione in pochissimo tempo.|Reception|pos|reception efficiente e disponibile risolvono qualsiasi situazione in pochissimo tempo
543|Reception funzionale e...|Reception funzionale e disponibile; risolvono qualsiasi problema in pochissimo tempo.|Reception|pos|reception funzionale e disponibile risolvono qualsiasi problema in pochissimo tempo
544|Reception funzionale e...|Reception funzionale e disponibile; risolvono qualsiasi situazione in pochissimo tempo.|Reception|pos|reception funzionale e disponibile risolvono qualsiasi situazione in pochissimo tempo
545|Staff cordiale e...|Staff cordiale e professionale al banco servizi di prima qualità.|Reception|pos|staff cordiale e professionale al banco servizi di prima qualità
546|Staff cordiale e...|Staff cordiale e professionale al banco servizi di ottima qualità.|Reception|pos|staff cordiale e professionale al banco servizi di ottima qualità
547|Staff cordiale e...|Staff cordiale e professionale al desk; servizi di prima qualità.|Reception|pos|staff cordiale e professionale al desk servizi di prima qualità
548|Staff cordiale e...|Staff cordiale e professionale al desk; servizi di ottima qualità.|Reception|pos|staff cordiale e professionale al desk servizi di ottima qualità
549|personale cordiale e...|personale cordiale e professionale al banco servizi di prima qualità.|Reception|pos|personale cordiale e professionale al banco servizi di prima qualità
550|personale cordiale e...|personale cordiale e professionale al banco servizi di ottima qualità.|Reception|pos|personale cordiale e professionale al banco servizi di ottima qualità
